{
  "id": "local-fanout-explore-oracle-v1-2026-07-09",
  "schema_version": 1,
  "kind": "performance",
  "provider": "other",
  "retrieved_at": "2026-07-09",
  "source_urls": [
    "https://github.com/tnunamak/minnows/tree/main/data/local-evals"
  ],
  "notes": "HARNESS SMOKE \u2014 not quality evidence. Answer-contaminated tasks. Reclassified 2026-07-09 (Sol+Fable).",
  "scores": [
    {
      "model": "claude-sonnet-5",
      "metric": "smoke-fanout.explore-oracle-v1",
      "score": 1.0,
      "unit": "other",
      "effort": "medium",
      "mode": "standard",
      "harness": "waspflow",
      "task_family": "fanout",
      "source_type": "local_eval",
      "evidence_grade": "D",
      "observed_at": "2026-07-09",
      "metric_id": "smoke-fanout-explore-oracle-v1",
      "caveat": "harness_smoke: local-eval task=fanout-explore-oracle-v1 op=fanout.explore oracle=pass"
    }
  ],
  "run": {
    "op": "fanout.explore",
    "task_id": "fanout-explore-oracle-v1",
    "policy_version": "0.1.2",
    "catalog_ref": "data-model-catalog-v0.5.0",
    "expands_to": {
      "provider": "claude",
      "model": "claude-sonnet-5",
      "effort": "medium",
      "mode": "standard"
    },
    "passed": true,
    "oracle_detail": "Task: Identify which file defines the `Color` enum and record the relative path in answer.txt.\n\nWhat was done:\n- Searched the repository under `src/` for a `Color` enum definition using grep.\n- Found `class Color(Enum):` defined at src/colors.py:2.\n- Wrote the relative path `src/colors.py` to answer",
    "classification": "harness_smoke",
    "not_quality_evidence": true
  },
  "source_ids": [
    "local-evals-waspflow-2026-07-09"
  ]
}
